speaker	original	traduit
1	What is I think they're probably something important to how it matters to you to really connect with everybody there.	Ce qui est je pense qu'ils sont probablement quelque chose d'important pour la façon dont il importe pour vous de vraiment communiquer avec tout le monde là-bas.
1	There might be multiple reasons for it, but it seems important.	Il y a peut-être plusieurs raisons à cela, mais cela semble important.
2	What is that?	Qu'est-ce que c'est ?
2	I feel.	Je sens.
2	Like I need to show my devotion in interest, but like people need to be reminded.	Comme si je devais montrer ma dévotion dans l'intérêt, mais comme les gens doivent être rappelés.
2	But I'm not going to like approach someone and be like they're like, how are you and I'm like, I'm great.	Mais je n'aimerai pas approcher quelqu'un et être comme eux, comment allez-vous et moi, je vais bien.
2	How are you great.	Comment ça va ?
2	I like what you're wearing or something.	J'aime ce que tu portes.
2	That doesn't take that much energy.	Ça ne prend pas tant d'énergie.
1	Right.	Oui.
1	How is the trip end?	Comment se termine le voyage ?
2	Right, like I show up and I'm like, how is blah blah blah blah blah.	Bien, comme je me pointe et je suis comme, comment va blah blah blah blah.
2	like whatever happened to	comme ce qui est arrivé à
1	How is your son doing at college?	Comment va ton fils à la fac ?
2	not even that like whatever happened to your son basketball coach thing.	Même pas comme ce qui est arrivé à ton fils basket-ball truc.
2	or like	ou similaires
1	Like a very specific reference to a previous conversation.	Comme une référence très précise à une conversation précédente.
2	yeah, we're often people people.	Oui, on est souvent des gens.
2	We're also coming up to me a lot and like a couple of my dad's colleagues like really wanted me to send them a speech which was kind of pretty cool, but	On vient aussi beaucoup vers moi et comme quelques collègues de mon père comme vraiment voulu que je leur envoie un discours qui était plutôt cool, mais
2	You know a lot of people were like, wow, it's so great that you still play saxophone or like I don't know there was just like compliments the entire night.	Tu sais, beaucoup de gens étaient comme, wow, c'est tellement génial que tu joues encore du saxophone ou comme je ne sais pas qu'il y avait juste des compliments toute la nuit.
2	And I also feel like I want to say something meaningful if I'm not just going to say thank you so much, which I did for a lot of people there's also like how did you learn?	Et j'ai aussi l'impression de vouloir dire quelque chose de significatif si je ne vais pas juste vous remercier tant, ce que j'ai fait pour beaucoup de gens il y a aussi comme comment avez-vous appris?
2	Like, how does jazz work?	Comment le jazz fonctionne-t-il ?
2	Did you know the tune before I hand did you practice or like how did you write your speech like what a great speech is so lucky.	Saviez-vous la chanson avant que je vous donne la main a pratiqué ou comme comment avez-vous écrit votre discours comme quel grand discours est si chanceux.
2	And I think I found myself like really trying to reach deeply and ask like, how did I write the speech?	Et je pense que je me suis trouvé comme vraiment essayer d'atteindre profondément et demander comme, comment ai-je écrit le discours?
2	I don't know.	Je ne sais pas.
2	I sort of like.	J'aime bien.
2	A whole lot about it.	Beaucoup de choses à ce sujet.
2	I didn't write much until today and I don't know it's like this whole building the wheel every time or most people seem to recycle a lot more.	Je n'ai pas beaucoup écrit avant aujourd'hui et je ne sais pas si c'est comme si tout ce bâtiment était la roue à chaque fois ou la plupart des gens semblent recycler beaucoup plus.
1	Yeah, it's like you really almost maybe even a little bit like scrumptiously try to bring yourself to each conversation.	Ouais, c'est comme si tu avais peut-être un peu l'air d'essayer de t'amener à chaque conversation.
2	What does scrupulously mean?	Qu'est - ce que cela signifie scrupuleusement?
1	like with careful attention	comme avec une attention particulière
2	Yeah, I got like stuck in that mode.	Oui, j'étais coincé dans ce mode.
2	I can't pull myself out and zone out.	Je ne peux pas sortir et faire une zone.
2	Or like go back to where I'm just like sitting.	Ou comme retourner là où je suis comme assis.
1	Yeah, you've been very very on.	Oui, tu as été très occupé.
2	Yeah.	Oui.
1	And enjoying it and into it.	Et j'en profite et j'en profite.
2	Yeah.	Oui.
1	An immersed but also sort of and most importantly not aware of how much energy and effort it takes and how it can Tire you out after a while.	Un immergé mais aussi une sorte de et surtout pas conscient de combien d'énergie et d'effort il prend et comment il peut Tirez-vous après un certain temps.
2	Yeah, I think I realized it kind of a lot later.	Oui, je crois que j'ai réalisé ça beaucoup plus tard.
1	Yeah, the thought that I had was that.	Oui, je pensais que c'était ça.
1	I wonder if sort of given the contacts and given what you wrote how much it's an impart sound up with your relationship with your parents.	Je me demande si, vu les contacts et ce que tu as écrit, c'est un indice avec ta relation avec tes parents.
1	Like it's kind of like part of how you reflect what they shown you about family.	Comme si c'était une partie de la façon dont on reflétait ce qu'on vous a montré au sujet de la famille.
1	And part of your sort of devotion and appreciation for that.	Et une partie de votre sorte de dévouement et d'appréciation pour cela.
2	They don't.	Ils ne le font pas.
2	We don't show their devotion in the same way.	Nous ne montrons pas leur dévotion de la même manière.
2	Like they're not trying to make a deep connection with everybody every single time.	Comme s'ils n'essayaient pas de faire un lien profond avec tout le monde à chaque fois.
2	They talk to someone that's my own way.	Ils parlent à quelqu'un à ma façon.
2	But I think like in the spirit of	Mais je pense comme dans l'esprit de
1	haha	Haha
2	Like in what kind of spirit and bringing to it?	Comme dans quel genre d'esprit et d'apporter à elle?
1	Yeah.	Oui.
2	If you're not sort of touching your mouth when you offer a suggestion or a or an interpretation your hand goes to your mouth.	Si vous ne touchez pas votre bouche quand vous proposez une suggestion ou une interprétation, votre main va à votre bouche.
1	I never knew that.	Je ne l'ai jamais su.
2	You have to feel unconscious about it now.	Vous devez vous sentir inconscient à ce sujet maintenant.
2	But it happens.	Mais ça arrive.
2	It's like that's your position for like I made an offer and let's do that.	C'est comme si c'était votre position, comme si j'avais fait une offre et faisons ça.
2	I found out more about my very early relationship with the oldest female cousin.	J'en ai appris plus sur ma relation très précoce avec la cousine la plus âgée.
2	She was there.	Elle était là.
2	First of all, my parents think that it was a matter of a couple of days that I was really really sad and gloomy.	Tout d'abord, mes parents pensent que c'était une question de quelques jours que j'étais vraiment triste et triste.
1	Yeah.	Oui.
2	I saw remember as feeling like a couple of weeks, but I'm sure they're right.	Je me suis souvenu que j'avais l'impression d'avoir quelques semaines, mais je suis sûr qu'ils ont raison.
2	They said that the write-up was extremely painful that was like the worst of it where it was like the transition like I'm being like all my connections are being like cut off completely torn away from me, but that wasn't but that was when I was quite a bit older when I was a few months old her family lived in Virginia at that time, and we would spend many weekends there especially during this time that my mom was from what I understand now very depressed and it was very hard for her.	Ils ont dit que l'écriture était extrêmement douloureuse qui était comme le pire où c'était comme la transition comme si j'étais comme si toutes mes connexions étaient comme coupées complètement arrachées de moi, mais ce n'était pas mais c'était quand j'étais un peu plus vieux quand j'avais quelques mois sa famille vivait en Virginie à ce moment-là, et nous allions passer de nombreux week-ends là-bas surtout pendant ce temps que ma mère était de ce que je comprends maintenant très déprimée et c'était très dur pour elle.
1	I just moved there.	Je viens d'emménager là-bas.
2	Yeah, just moved.	Ouais, je viens de bouger.
2	My dad had just	Mon père venait d'arriver.
1	Done his defense.	Il s'est défendu.
1	Yeah.	Oui.
2	just defended.	juste défendu.
2	I was three weeks old when they moved and then my mom had never lived away from home and had this new daughter and was like totally depressed for about a year.	J'avais trois semaines quand ils ont déménagé et puis ma mère n'avait jamais vécu loin de chez moi et avait cette nouvelle fille et était comme totalement déprimée pendant environ un an.
2	This is part of my questioning to her like why like she brings it in a way that doesn't focus on the feelings.	Cela fait partie de mon questionnement à elle comme pourquoi elle l'apporte d'une manière qui ne se concentre pas sur les sentiments.
2	It's like it focuses on explaining why she was feeling bad.	C'est comme s'il s'agissait d'expliquer pourquoi elle se sentait mal.
2	And then what she did she couldn't really do much.	Et puis ce qu'elle a fait, elle n'a pas vraiment pu faire grand-chose.
2	It was like she was away from home.	C'était comme si elle était loin de chez elle.
2	My dad was gone.	Mon père était parti.
2	I was like crying all of the time her parents were very preoccupied my grandpa.	J'étais comme pleurer tout le temps que ses parents étaient très préoccupés mon grand-père.
2	My grandfather had started a business like as a second career that completely failed and they were losing a lot of money so she couldn't	Mon grand-père avait commencé une entreprise comme une deuxième carrière qui a complètement échoué et ils perdaient beaucoup d'argent pour qu'elle ne puisse pas
1	What was it?	Qu'est-ce que c'était ?
2	The business I think it was like a mark some kind of Bodega.	Je pense que c'était comme une marque d'une sorte de Bodega.
1	haha	Haha
2	Is an entomologist.	C'est un entomologiste.
1	right	droite
2	He was teaching also but I think he's always had an interest in business, but I don't think he had it doesn't sound like he was a very fruitful venture.	Il enseignait aussi, mais je pense qu'il s'est toujours intéressé aux affaires, mais je ne pense pas qu'il ait eu l'impression qu'il était une entreprise très fructueuse.
1	Yeah.	Oui.
2	So they could have talked on the phone and her sister lived like an hour and a half away.	Pour qu'ils aient pu parler au téléphone et que sa sœur vive à une heure et demie.
2	So I think that was really important for her to get through.	Donc je pense que c'était très important pour elle de passer.
1	Is your dad working long hours?	Ton père travaille de longues heures ?
2	Yeah, I think he was probably working at least it was an hour commute.	Oui, je pense qu'il travaillait au moins une heure de trajet.
2	She was probably gone at least 9 hours of the day.	Elle était probablement partie au moins 9 heures de la journée.
2	I mean	Je veux dire
2	I don't know.	Je ne sais pas.
2	I don't know what his hours were.	Je ne sais pas quelles étaient ses heures.
2	Okay.	Très bien.
2	Sorry, like got really obsessed with finding my dad's undergraduate dissertation.	Désolé, j'étais obsédée par la thèse de mon père.
1	the Harvester	la moissonneuse
2	Yeah, so I was like looking at the University's web archives.	Oui, donc j'étais comme regarder les archives web de l'Université.
2	And anyway in the process, I found out that I can look at anybody's dissertation in the whole world and I spent a bunch of time reading yours.	Et de toute façon, j'ai découvert que je pouvais regarder n'importe qui dans le monde entier et j'ai passé un tas de temps à lire le tien.
1	Oh.	Oh, c'est ça.
2	I had to disclose that.	J'ai dû le révéler.
1	What were your thoughts and reaction?	Quelles étaient vos pensées et vos réactions ?
2	Well, okay, so I was like writing the speech and I wasn't really reading it for the content.	J'étais comme écrire le discours et je ne le lisais pas vraiment pour le contenu.
1	Sure.	Bien sûr.
2	I was reading it for negative deep inside about your personality.	Je le lisais pour négatif au fond de votre personnalité.
2	In your life and there wasn't really a lot of those.	Dans ta vie, il n'y en avait pas beaucoup.
2	I wonder what my mom infant mother died on the nature of our diet was when I was an infant.	Je me demande ce que ma mère est morte sur la nature de notre alimentation, c'est quand j'étais bébé.
2	It sounds like it falls more until she was withdrawn and I was	On dirait que ça tombe plus avant qu'elle ne soit retirée et j'étais
1	Bussy	Bussy
2	spicy rather than her being intrusive in my being whatever.	épicée plutôt que d'être intrusive dans mon être.
2	Yeah avoidant just from like what I have heard about what she was going through in that time.	Oui, c'est comme si j'avais entendu parler de ce qu'elle traversait à ce moment-là.
2	And I wonder if she hated me.	Et je me demande si elle me détestait.
2	This is all in the context of what I read.	Tout cela est dans le contexte de ce que j'ai lu.
2	So we would go to her sister's house and Selma was like 9 and apparently she would just like pick me up out of her car seat like strep miadora hip and carry me like that for the entire weekend.	Donc nous allions chez sa sœur et Selma était comme 9 et apparemment elle aimerait juste me sortir de son siège auto comme strep miadora hip et me porter comme ça pendant tout le week-end.
2	She would go from place to place to place and I was like, I was really like her doll.	Elle allait d'un endroit à l'autre et j'étais comme, j'étais vraiment comme sa poupée.
2	We were inseparable and she was completely adoring and loving and like needed and wanted me to just go everywhere with her.	Nous étions inséparables et elle était complètement adorable et aimante et comme nécessaire et voulait que j'aille partout avec elle.
2	It wasn't like she necessarily played a whole lot with me, but just had me with her everywhere.	Ce n'était pas comme si elle jouait forcément beaucoup avec moi, mais qu'elle m'avait avec elle partout.
2	This was I think many weekends of that first year.	Je pense que c'était plusieurs week-ends de cette première année.
1	It is also possible.	C'est également possible.
1	I don't think this is a comment how she was I don't know but you know some others who are depressed pull it together pretty well.	Je ne pense pas que ce soit un commentaire comment elle était je ne sais pas, mais vous savez que d'autres qui sont déprimés le font assez bien.
2	I think she was probably one of them.	Je pense qu'elle était probablement l'une d'entre elles.
1	Yeah.	Oui.
2	I think relative to the rest of her life.	Je pense que c'est par rapport au reste de sa vie.
2	This was the darkest time for her.	C'était le moment le plus sombre pour elle.
1	Yeah.	Oui.
2	But it doesn't sound like there is anything outstanding about how she treated me or how she interacted with me.	Mais on ne dirait pas qu'il y ait quelque chose d'exceptionnel dans la façon dont elle m'a traité ou comment elle a interagi avec moi.
2	I don't know.	Je ne sais pas.
1	Yeah.	Oui.
1	We have about 5 minutes.	Nous avons environ 5 minutes.
1	One thing I'm wondering about is the extent to which you feel a similar kind of pole or sense of being.	Une chose que je me demande est la mesure dans laquelle vous ressentez un genre similaire de pôle ou de sentiment d'être.
1	On and how you would want to talk and connect you.	Et comment tu voudrais parler et te connecter.
1	And what you were you would be lost or I think more specifically that like I might miss about you or we might not share if you're not that way.	Et ce que vous étiez vous seriez perdu ou je pense plus spécifiquement que comme je pourrais manquer de vous ou nous pourrions ne pas partager si vous n'êtes pas comme ça.
2	Yeah, I was just thinking about that, too.	Oui, je pensais à ça aussi.
1	Yep.	Oui.
2	Yeah, I really do feel that way.	Oui, je le sens vraiment.
2	I don't know what I would lose.	Je ne sais pas ce que je perdrais.
2	I guess I would.	Je crois que je le ferais.
2	Waste minutes.	J'ai perdu des minutes.
2	Like I do feel kind of an urgency here.	Comme si je me sentais un peu d'urgence ici.
2	That I have to fill up all of the time.	Que je dois remplir tout le temps.
2	But if I'm choosing not to that's it should be really important to me.	Mais si je choisis de ne pas le faire, ça devrait être très important pour moi.
2	how to lose the chance to show you how committed I am	comment perdre la chance de vous montrer à quel point je suis engagé
2	or how special you should think I am.	Ou à quel point tu devrais penser que je suis spécial.
2	But I don't feel that extra layer of filtering or sensor in here.	Mais je ne sens pas cette couche supplémentaire de filtrage ou de capteur ici.
2	It doesn't feel like I don't feel like I'm	Je n'ai pas l'impression de ne pas être
2	Planning or scheming or anything?	Vous planifiez ou planifiez ou quoi ?
2	It just feels like whatever I have at this time, like should be yours in such a way that you really see who I am and appreciate it and love it.	C'est comme si tout ce que j'ai en ce moment, comme si c'était le tien de telle façon que tu vois qui je suis, que tu l'apprécies et que tu l'aimes.
1	Somehow that could happen differently if you weren't his Focus like, you know what I mean?	Ça pourrait arriver différemment si tu n'étais pas son Focus, tu vois ce que je veux dire ?
2	I know I understand.	Je sais que je comprends.
2	What you're saying?	Qu'est-ce que tu racontes ?
2	I don't know.	Je ne sais pas.
1	When I'm getting it.	Quand je l'aurai.
2	I don't know how it happened differently.	Je ne sais pas comment ça s'est passé différemment.
1	I see I guess I had thought that there's maybe something that gets left out a little bit and making the effort.	Je crois que j'avais pensé qu'il y avait peut-être quelque chose qui serait un peu oublié et qui ferait l'effort.
1	I'm not saying that it's bad to make effort.	Je ne dis pas que c'est mauvais de faire des efforts.
1	That's certainly not what I'm saying, but that there's some part of you that gets left behind a little bit.	Ce n'est certainement pas ce que je dis, mais qu'il y a une partie de vous qui reste un peu derrière.
1	Or judge by you, not quite as good or worthwhile in some way.	Ou jugez par vous, pas aussi bon ou valable d'une manière ou d'une autre.
1	I think that's the part that isn't involved with trying or something.	Je pense que c'est la partie qui n'est pas impliquée dans l'essai ou quelque chose.
2	I think I get why it feels so scary to not want to try and general and why it feels like that's going to be the end of the world if I fall into.	Je pense que je comprends pourquoi c'est si effrayant de ne pas vouloir essayer et pourquoi c'est comme si ça allait être la fin du monde si je tombe dedans.
2	A space where I'm not feeling connected.	Un espace où je ne me sens pas connecté.
2	I'm not feeling	Je ne me sens pas.
2	Momentum or like not trying.	Momentum ou comme ne pas essayer.
2	And I think I do fall into that space and it's very bad and scary and I'm not accepting it as much as I accept the other mode.	Et je pense que je tombe dans cet espace et c'est très mauvais et effrayant et je ne l'accepte pas autant que j'accepte l'autre mode.
1	It may be irrelevant.	Ce n'est peut-être pas pertinent.
1	But it's just funny how these things come up together.	Mais c'est drôle comme ça.
1	It does make me think of your mom being kind of depressed when you were little and feeling like even she could manage that pretty well and how she was with you that it took effort.	Ça me fait penser que ta mère était un peu déprimée quand tu étais petite et que tu te sentais comme si même elle pouvait bien gérer ça et comment elle était avec toi qu'il a fallu de l'effort.
1	You know what?	Tu sais quoi ?
1	I mean, like how to gather herself somewhat.	Je veux dire, comme comment se rassembler un peu.
2	What's the alternative?	Quelle est l'alternative ?
1	Well, I'm not going to answer that one.	Eh bien, je ne vais pas répondre à celui-là.
1	I guess you may be asking rhetorically.	Je suppose que vous demandez peut-être rhétoriquement.
2	No, I don't.	Non, pas du tout.
2	I can't imagine a model of the alternative.	Je ne peux pas imaginer un modèle de l'alternative.
1	Okay.	Très bien.
2	I think I have to make it.	Je crois que je dois y arriver.
2	Like figure out what the model is for me.	Comme trouver quel est le modèle pour moi.
1	We need to stop unfortunately.	Nous devons malheureusement arrêter.
1	I'll have to think about.	Je vais devoir réfléchir.
2	What?	Quoi ?
1	I'll have to think about.	Je vais devoir réfléchir.
2	You don't have to think about it at all.	Tu n'as pas à y penser du tout.
1	I think I do to tell you the truth.	Je crois que je dois te dire la vérité.
1	I think it's so that I will shut up and let you talk.	Je pense que c'est pour que je te la ferme et que je te laisse parler.
2	Bye.	Au revoir.
