speaker	original	traduit
1	You feel so sad to me.	Tu te sens si triste avec moi.
2	Yeah.	Oui.
1	It isn't even an appearance thing.	Ce n'est même pas un truc d'apparence.
1	It just feels like there's just a weight of the world on your shoulders right now with this whatever.	On dirait qu'il n'y a qu'un poids sur les épaules avec ça.
1	This is is stirring around your father like the whole family history of genocide and Trauma and torture.	C'est émouvant autour de votre père comme toute l'histoire familiale du génocide, du traumatisme et de la torture.
1	There's a lot in this Brian.	Il y a beaucoup dans ce Brian.
1	It's hard enough just to be trying to remember in here in this process and kind of your pace getting yourself through a real thing actually just happened in a real-time and this is like other things.	C'est assez difficile juste d'essayer de se souvenir ici dans ce processus et un peu de votre rythme de vous faire traverser une chose réelle en fait vient de se produire en temps réel et c'est comme d'autres choses.
1	It's not all nevermind you and brings you back to feelings of these other experiences, but other another one you're experiencing right now, like all the feelings after your father's death that led you to cut yourself off and being meter lost in the world.	Ce n'est pas tout ce que vous n'avez jamais pensé et vous ramène aux sentiments de ces autres expériences, mais autre une autre que vous vivez en ce moment, comme tous les sentiments après la mort de votre père qui vous ont conduit à vous couper et être perdu de compteur dans le monde.
1	To the world out to Oregon just aimless and Associated I can imagine that hopefully on a smaller scale and hopefully caught that kind of what we're here to do and help you but I can imagine that being a piece of what's happening right now.	Pour le monde entier à Oregon juste sans but et Associated Je peux imaginer que espérons sur une plus petite échelle et espérons attrapé ce genre de ce que nous sommes ici pour vous aider mais je peux imaginer qu'être une partie de ce qui se passe en ce moment.
1	You have enough work under your belt and that there's this other life that you have going on that feels like it's yours in your attending to it.	Vous avez assez de travail sous votre ceinture et qu'il y a cette autre vie que vous avez en train de vivre qui a l'impression que c'est la vôtre dans votre assistance à elle.
1	But how could this not be triggering for you for of some of the pretty dramatic feelings about to mention where you were right before this happened in the process?	Mais comment cela ne pourrait-il pas vous déclencher pour certains des sentiments assez dramatiques sur le point de mentionner où vous étiez juste avant que cela se produise dans le processus?
2	and the funny thing is that I knew that the	et le plus drôle, c'est que je savais que le
2	not that was happening even before like when the bombings happen.	Ce n'était pas ce qui se passait avant, comme quand les bombardements se produisaient.
2	I knew that something triggered.	Je savais que quelque chose s'était déclenché.
2	It's just like what the fuc the only two things I keep telling myself is that one?	C'est comme si c'était la seule chose que je me disais ?
2	It's not just me.	Ce n'est pas que moi.
2	It happened in a whole neighborhood and number two.	C'est arrivé dans tout un quartier et numéro deux.
2	People died in those families people are named.	Les gens sont morts dans ces familles, les gens sont nommés.
2	and	et
2	a number to at least I have this one to come to also this is an opportunity to instead of becoming so disassociated.	un nombre à au moins j'ai celui-ci à venir à aussi c'est une occasion pour au lieu de devenir si dissocié.
2	That's where work can ground you.	C'est là que le travail peut vous écraser.
2	I just have to find a way to regain some energy right now.	Je dois juste trouver un moyen de récupérer de l'énergie en ce moment.
2	That's what it is.	C'est ça.
2	I just feel like I have no energy.	J'ai l'impression de n'avoir pas d'énergie.
2	I just feel kind of sick.	Je me sens un peu malade.
1	I think what I say, of course in no wonder as part of just trying to say the part of you thinking that really gets anxious about where you are today.	Je pense que ce que je dis, bien sûr, n'est pas étonnant dans le cadre d'essayer juste de dire la partie de vous qui pense que vraiment s'inquiète de l'endroit où vous êtes aujourd'hui.
1	And what would be weird if you were there today given your history.	Et ce qui serait bizarre si tu étais là aujourd'hui vu ton histoire.
2	Yeah, yeah.	Ouais, ouais.
1	You can go back to Doctor Carlton.	Vous pouvez retourner chez le docteur Carlton.
1	I don't think this is something that we should medicate.	Je ne pense pas que ce soit quelque chose qu'on devrait traiter.
1	This is what you would do.	C'est ce que tu ferais.
1	If something like this happened, it's starting to happen after Monday and you come out of this probably actually sooner than you think.	Si quelque chose comme ça s'est passé, ça commence à arriver après lundi et vous en sortez probablement plus tôt que vous ne le pensez.
2	Yeah, yeah, right right.	Oui, c'est ça.
2	I've been in mining myself of that too.	J'ai été dans l'exploitation moi-même de ça aussi.
2	That's where I was trying.	C'est là que j'essayais.
2	That's what I was saying.	C'est ce que je disais.
2	I'm actually handling it better than	En fait, je m'en occupe mieux que moi.
1	Totally I share you that's what you're saying.	Totalement, je vous partage ce que vous dites.
1	These are the things I keep trying to tell myself.	C'est ce que j'essaie de me dire.
1	It's part of what you're doing.	Ça fait partie de ce que tu fais.
2	Yeah, like you said I'm just kind of waiting to feel those things instead of telling myself those things.	Comme tu l'as dit, j'attends juste de ressentir ces choses au lieu de me les dire.
1	Even being interested in what your experiences of this instead of judging it.	Même être intéressé par ce que vos expériences de ceci au lieu de le juger.
2	Right.	Oui.
2	I'm trying not to be so hard on myself.	J'essaie de ne pas être si dur avec moi-même.
1	You're surrounded by judges as a kid so many judgements from your mother and from your mother's whole side of the family these these things are either good bad.	Vous êtes entouré par des juges comme un enfant tant de jugements de votre mère et de tout le côté de votre mère de la famille ces choses sont soit bonnes mauvaises.
1	Good bad good bad not just interested in your experience.	Bien mal bien mal pas seulement intéressé par votre expérience.
1	I think that's why so often you moved to wanting to judge yourself.	Je pense que c'est pour ça que tu as souvent voulu te juger toi-même.
1	Like this is bad that this is happening to me and then you say but the good thing is that I'm doing this.	Comme si c'était mauvais que ça m'arrive et que vous disiez, mais ce qui est bien, c'est que je fasse ça.
1	It's like things have to be judged as good or bad and there's something kind of comforting and familiar familiar and knowing whether it gets to go on it in the good column or if it gets to go in the bad, I just think that what's your family did but it's not about knowing who you are.	C'est comme si les choses devaient être jugées comme bonnes ou mauvaises et il y a quelque chose de réconfortant et familier et de savoir si cela peut aller dans la bonne colonne ou si ça peut aller dans la mauvaise, je pense juste que ce que votre famille a fait mais il ne s'agit pas de savoir qui vous êtes.
1	It's not about knowing it's about categorizing and black and white kind of thinking.	Il ne s'agit pas de savoir qu'il s'agit de catégoriser et de penser en noir et blanc.
1	What are you thinking?	Qu'est-ce que tu penses ?
2	Nothing specific.	Rien de précis.
2	I was all over the place.	J'étais partout.
1	To where?	Où ça ?
2	I don't know.	Je ne sais pas.
2	I was thinking on the one hand what sucks now is I'm full of anxiety.	Je pensais d'une part que ce qui craint maintenant, c'est que je sois plein d'anxiété.
2	But what is the next thing that's going to happen?	Mais quelle est la prochaine chose qui va se passer ?
2	Like what's the next bad thing that's going to happen.	Comme la prochaine mauvaise chose qui va arriver.
2	Today I was like I could try to write about this but then of course I was thinking yeah.	Aujourd'hui, j'étais comme si je pouvais essayer d'écrire à ce sujet, mais ensuite, bien sûr, je pensais oui.
2	Well, that's what I say about a lot of things and then I don't actually do anything.	Eh bien, c'est ce que je dis sur beaucoup de choses et puis je ne fais rien en fait.
1	You're trying to gather it into the all of your trauma.	Vous essayez de le rassembler dans tout votre traumatisme.
2	I'm not doing it.	Je ne vais pas le faire.
1	meaning writing or not getting people together	signifie écrire ou ne pas réunir les gens
2	Yeah, I know.	Oui, je sais.
2	Not really.	Pas vraiment.
2	It's a curse to be so ambitious and must be nice to just not be as much I have all these things on my plate.	C'est une malédiction d'être si ambitieux et doit être gentil de ne pas être autant que j'ai toutes ces choses sur mon assiette.
2	No one put them there.	Personne ne les a mis là.
2	I am paying them there, but I can't help it.	Je les paye là-bas, mais je n'y peux rien.
1	I think waiting for the next bad thing to happen is trauma.	Je pense qu'attendre que la prochaine mauvaise chose arrive est un traumatisme.
1	This is a symptom of being traumatized.	C'est un symptôme d'être traumatisé.
1	There's this hyper Village Inns is it happens many different for it takes many different forms expectation that something really bad is going to happen and just waiting for its in some way adopted way of being if you're used to really bad things and keep happening to you if you're at least prepared for them and that's what it's meant for in any way.	Il y a cet hyper Village Inns c'est qu'il se passe beaucoup de choses différentes car il prend beaucoup de formes différentes s'attend à ce que quelque chose de vraiment mauvais va se passer et juste attendre qu'il soit d'une certaine façon adopté si vous êtes habitué à vraiment mauvaises choses et continue à vous arriver si vous êtes au moins préparé pour eux et c'est ce qu'il est censé pour d'une manière ou d'une autre.
1	But again, why would you not be waiting for that right now and why also for example would not freeze you up from reading a regular underarm life and	Mais encore une fois, pourquoi ne pas attendre cela en ce moment et pourquoi aussi par exemple ne pas vous geler de la lecture d'une vie régulière de sous-arms et
1	That's also what happen when you were twenty if horrible horrible things happen your whole system starts to responding as if you were there for survival and waiting for the next blow.	C'est aussi ce qui se passe quand vous aviez vingt ans si d'horribles choses arrivent votre système entier commence à répondre comme si vous étiez là pour survivre et attendre le prochain coup.
1	It's not about that.	Ce n'est pas à propos de ça.
1	It's not about then forward-thinking and productivity and planning and being a proactive person reactivity.	Il ne s'agit pas alors de penser à l'avenir, de la productivité et de la planification et d'être une réactivité proactive de la personne.
1	It's what's important when you're in trauma for safety, I could see also this feeling as you look down on yourself that you're not	C'est ce qui est important quand vous êtes en trauma pour la sécurité, je pouvais voir aussi ce sentiment que vous regardez vers le bas sur vous-même que vous n'êtes pas
1	Doing it.	Fais-le.
1	That's what happens when your brain is preoccupied with staying safe and your brain became very pretty occupied with staying safe as you became really Psycho-Pass Matic after your father's death all of the fears about not me.	C'est ce qui arrive quand votre cerveau est préoccupé de rester en sécurité et votre cerveau est devenu très occupé à rester en sécurité comme vous êtes devenu vraiment Psycho-Pass Matic après la mort de votre père toutes les peurs de pas moi.
1	I'm not having I'm having a hard now me.	Je n'ai pas de mal, maintenant.
1	I'm now having a heart attack.	J'ai une crise cardiaque.
1	I'm getting am I getting cancer as a form of hyper Villages waiting for the thing that's going to go wrong in your own body.	J'ai le cancer comme une forme d'hyper Villages qui attend la chose qui va mal se passer dans votre propre corps.
1	I think you have a rationality to in your relationship with your mother before your father's death.	Je pense que vous avez une rationalité dans votre relation avec votre mère avant la mort de votre père.
1	She looks at a picture and says, oh she's beautiful and then oh, but she has a big mouse.	Elle regarde une photo et dit, oh elle est belle et puis oh, mais elle a une grande souris.
1	It's like there's there's a bad thing coming from the relationship.	C'est comme s'il y avait une mauvaise chose venant de la relation.
1	There's a dagger that you could be waiting for with Kelly or else we waiting to go out to Talia.	Il y a un poignard que tu pourrais attendre avec Kelly ou sinon on attend d'aller à Talia.
1	That's feels better.	Ça va mieux.
1	And I'm here.	Et je suis là.
1	I'm am I going to hurt you or are you going to hurt me?	Je vais te faire du mal ou tu vas me faire du mal ?
1	As you've gone closer to people you've gone to hurt one another or another in your early life.	Comme vous vous êtes rapprochés des gens, vous êtes allés vous blesser les uns les autres au début de votre vie.
2	You know that comedian Margaret Margaret Cho.	Tu connais la comédienne Margaret Margaret Cho.
2	Do you know what I'm talking about?	Tu sais de quoi je parle ?
2	She has a thang on salon.com.	Elle a un thang sur salon.com.
2	Children why she's ambivalent and she's pretty sure she doesn't want them.	Les enfants pourquoi elle est ambivalente et elle est presque sûre qu'elle ne veut pas d'eux.
2	There's one really good part towards the end where she's like in the end.	Il y a une très bonne partie vers la fin où elle est comme à la fin.
2	I don't think what it is is that I don't want to love anything.	Je ne pense pas que ce soit que je ne veuille rien aimer.
2	Much and I've something that I know is in me.	Beaucoup et j'ai quelque chose que je sais en moi.
2	I don't want to I was like, wow, that's such a simple way to say it.	Je ne veux pas être comme, wow, c'est une façon si simple de le dire.
2	I know exactly what she's talking about.	Je sais exactement de quoi elle parle.
2	There's something reverse Leaf ring and not going there completely.	Il y a quelque chose de l'anneau de feuille inversée et ne va pas là-bas complètement.
2	I think she even says something like not letting something that much even myself.	Je pense qu'elle dit même quelque chose comme ne pas laisser quelque chose autant même moi.
2	I was like, yeah that makes perfect sense.	J'étais comme, ouais ça a un sens parfait.
1	That makes perfect sense when you love that much.	C'est tout à fait logique quand on aime autant.
1	You got hurt.	Tu as été blessé.
2	right	droite
1	That's very very sad tomorrow.	C'est très triste demain.
2	Okay, 12:30.	D'accord, 12 h 30.
2	Alright.	Très bien.
2	Thanks.	C'est gentil.
2	See you.	A tout à l'heure.
