speaker	original	traduit
1	But you had nothing to do with the wire being late, right?	Mais tu n'as rien à voir avec le fil en retard, pas vrai ?
2	No, I asked emitted the money for them.	Non, je leur ai demandé de leur donner l'argent.
2	I was pretty close and I gave them the heads up once I saw their loan balance was what their loan balance was how they could not take their loan balance and add the commission and realize that that was over over the shell price.	J'étais assez proche et je leur ai donné la tête haute une fois que j'ai vu leur solde de prêt était ce que leur solde de prêt était comment ils ne pouvaient pas prendre leur solde de prêt et ajouter la commission et de réaliser que c'était plus sur le prix de coque.
2	I don't know.	Je ne sais pas.
2	I know not everybody is good with numbers.	Je sais que tout le monde n'est pas bon avec les chiffres.
2	But before they sold the place I went through and told them what the fees and expenses are going to be there were supposed to pick the sale price based on not having to bring money at closing but	Mais avant qu'ils ne vendent l'endroit que j'ai traversé et leur ai dit ce que les frais et les dépenses vont être là étaient censés choisir le prix de vente basé sur le fait de ne pas avoir à apporter d'argent à la fermeture, mais
1	Bright apparently not.	Il fait beau, apparemment pas.
2	I mean, it's 250,000 251,000 actually, which is pretty cheap for anything in that area.	Je veux dire, c'est 250.000 251,000 en fait, ce qui est assez bon marché pour n'importe quoi dans ce domaine.
1	So it's in this area?	Donc c'est dans cette zone ?
2	It's like a one-bedroom.	C'est comme une chambre à coucher.
2	It's Garden level.	C'est le niveau du jardin.
2	It's over a pond right by the football field.	C'est au-dessus d'un étang juste à côté du terrain de football.
2	At the pool it runs right alongside the park so you're right there.	À la piscine, il court juste à côté du parc, donc vous êtes juste là.
2	You got the bus stops Whole Foods Trader Joe's CVS.	Tu as les arrêts de bus du CVS de Whole Foods Trader Joe.
1	Yep, right by the highway.	Oui, juste à côté de l'autoroute.
2	Organic sushi place liquor store.	Magasin d'alcool à la place des sushis biologiques.
2	It's pretty cool.	C'est plutôt cool.
2	It would be a good spot for me.	Ce serait un bon endroit pour moi.
2	I'll have to think about it.	Je vais devoir y réfléchir.
1	Yeah, maybe that's what it is and the trial as well you feel like so if I try I'm going to fuck it up or the other person is so domineering or she's going to know more or the judge is going to side with her somehow or I won't follow through with what I need to anyway.	Ouais, peut-être que c'est ce que c'est et le procès aussi bien que vous vous sentez comme si si si j'essayais de tout foutre en l'air ou si l'autre personne est tellement dominatrice ou si elle en sait plus ou si le juge va être de son côté d'une façon ou si je n'obéis pas à ce que j'ai besoin de faire de toute façon.
1	So, what's the point?	Alors, qu'est-ce qu'il y a ?
2	Yeah, that's a big one and you're myself up to like okay.	Ouais, c'est un gros et tu es moi-même jusqu'à aimer bien.
2	This is what you're going to do and then I don't do it or I feel like I'm not going to do it.	C'est ce que tu vas faire et ensuite je ne le fais pas ou j'ai l'impression de ne pas le faire.
1	Actually usually do the things work, I think.	En fait, les choses marchent, je crois.
2	I took my blood pressure down and it was high.	J'ai baissé ma pression artérielle et elle était élevée.
2	I'm off the blood pressure medication.	Je ne prends plus de médicaments contre la pression artérielle.
2	I don't want to go back on it.	Je ne veux pas y retourner.
2	But I may have to it sucks.	Mais ça craint peut-être.
2	I'm tired of all the pills.	J'en ai assez de toutes les pilules.
2	I beat myself up to get this Rush title done down while Ian is bothering me.	Je me suis battu pour avoir ce titre de Rush terminé pendant que Ian me dérange.
2	I'm working away on at all morning.	Je travaille toute la matinée.
2	And I forgot to send it.	Et j'ai oublié de l'envoyer.
2	They sent me an e-mail yesterday morning house this coming.	Ils m'ont envoyé un e-mail hier matin à la maison.
2	I was like, oh I finished it last week and forgot to send it to you while I've got to get an email to them.	J'ai fini la semaine dernière et j'ai oublié de vous l'envoyer pendant que je dois leur envoyer un mail.
2	They owe me over 3,000 now and I don't know what I don't know what's closed and what hasn't, you know, maybe I could do that today.	Ils me doivent plus de 3000 dollars maintenant et je ne sais pas ce que je ne sais pas ce qui est fermé et ce qui n'a pas, tu sais, peut-être que je pourrais le faire aujourd'hui.
2	What I've got to do is everything for me comes up by invoice number, but they've got everything by property address.	Ce que j'ai à faire, c'est que tout pour moi vient par numéro de facture, mais ils ont tout par adresse de propriété.
2	So	Alors
2	They're going to know whether it's closed or Not by property address not the invoice.	Ils vont savoir si c'est fermé ou pas par l'adresse de la propriété, pas par la facture.
2	I've got to go through and make a list for them that matches up the invoice number with the property address.	Je dois faire une liste pour eux qui correspond au numéro de la facture à l'adresse de la propriété.
2	I have no way of generating that other than manually and there are a lot of them out there.	Je n'ai aucun moyen de générer ça autrement que manuellement et il y en a beaucoup dehors.
2	I think I'm just going to do an end-of-the-year open invoice if I'm not going to get the money until next year then taxes go up.	Je pense que je vais juste faire une facture ouverte de fin d'année si je ne vais pas obtenir l'argent avant l'année prochaine alors les impôts augmentent.
2	Something's rattling your sprinkler.	Quelque chose balance ton arroseur.
2	It's very frustrating because I kind of get like I have all these closings lined up every time the money comes in.	C'est très frustrant parce que j'ai l'impression d'avoir toutes ces fermetures alignées à chaque fois que l'argent arrive.
2	I don't know where it all goes.	Je ne sais pas où tout va.
2	It's gone.	C'est parti.
2	I'm trying to get to them to the point where I have expenses put away.	J'essaie d'aller jusqu'au point où j'ai des dépenses.
2	So when I have a bad month or two, I can survive that but it's like I can't get to the point.	Donc quand j'ai un mois ou deux mauvais, je peux survivre à ça mais c'est comme si je ne pouvais pas en arriver là.
2	I could not buy tickets and stuff like that.	Je ne pouvais pas acheter des billets et des trucs comme ça.
2	But what's that going to do for my depression?	Mais qu'est-ce que ça va faire pour ma dépression ?
2	It's a catch-22.	C'est une prise-22.
2	If I didn't if I don't go to the games, I'll be depressed and spending the money on the games makes me depressed.	Si je ne l'ai pas fait si je ne vais pas aux jeux, je serai déprimé et dépenser l'argent pour les jeux me fait déprimer.
1	I thought you bought the tickets all at once.	Je croyais que tu as acheté les billets tout d'un coup.
2	Yeah, but still the end of EX coming up so much of it is taxes.	Oui, mais quand même la fin du EX qui arrive, c'est les impôts.
2	Do you pay your estimated taxes like a good boy?	Vous payez vos impôts estimés comme un bon garçon ?
1	Yes.	Oui.
2	That's what I'm thinking about.	C'est à ça que je pense.
2	Next is January every month starts the state and every 3 months.	Le prochain est Janvier tous les mois commence l'état et tous les 3 mois.
2	There's the estimated.	Voilà l'estimation.
2	That's the other thing.	C'est l'autre chose.
2	I'm trying to have money set aside for estimated taxes.	J'essaie de mettre de l'argent de côté pour les impôts estimés.
2	Every time I try to put money into my savings account or whatever.	Chaque fois que j'essaie de mettre de l'argent dans mon compte d'épargne ou quoi que ce soit.
2	I've got to pull it out 2 weeks later or something.	Je dois l'enlever deux semaines plus tard ou quelque chose comme ça.
2	At least I'm getting caught up big-time on my rent.	Au moins, j'ai été pris en charge par mon loyer.
2	I was really behind.	J'étais vraiment en retard.
2	I think I'm almost caught up.	Je crois que je suis presque pris.
2	I think I'm still a couple of months behind but like just November and December, I think maybe I don't know.	Je crois que j'ai encore quelques mois de retard, mais comme en novembre et décembre, je ne sais peut-être pas.
2	I got caught up on my student loans.	J'ai été rattrapé par mes prêts étudiants.
1	if for you	si pour vous
2	Which I was in serious default.	Ce que j'étais dans un sérieux défaut.
2	I'm getting caught up on the website.	Je me fais prendre sur le site.
2	I was way behind on that.	J'étais bien en retard là-dessus.
2	I'm still some I'm still somewhat behind on it.	Je suis encore un peu en retard.
2	But there's always like I forgotten about $300 to service I didn't pay for but when I close the lawn normally I just cut the check right then for the survey.	Mais il y a toujours comme si j'avais oublié environ 300 $ pour le service que je n'ai pas payé, mais quand je ferme la pelouse normalement, je coupe le chèque juste alors pour l'enquête.
1	service	service
2	Yeah plot plan.	Oui, plan d'intrigue.
2	It's like with these guys should be cutting me for the title.	C'est comme si ces gars me coupaient pour le titre.
2	As soon as they finish the closing a check for Cameron.	Dès qu'ils auront fini la fermeture, un chèque pour Cameron.
2	I try and do the same thing, but I forget which is what they do when cleared the only reason I remember it is because a check I'd written in November just cleared unlike all Buck.	J'essaie de faire la même chose, mais j'oublie ce qu'ils font quand ils sont nettoyés la seule raison pour laquelle je me souviens que c'est parce qu'un chèque que j'avais écrit en novembre vient d'être nettoyé contrairement à tout Buck.
2	I forgot to pay those two.	J'ai oublié de payer ces deux-là.
2	There's just always something.	Il y a toujours quelque chose.
2	I'm going out for my grandmother's 90th birthday party.	Je sors pour la fête d'anniversaire de ma grand-mère.
2	I'm taking you in I think my mom is going to pay for his ticket.	Je t'emmène, je crois que ma mère va payer son billet.
2	I've got to buy the tickets.	Je dois acheter les billets.
2	They just came down $4.	Ils sont tombés à 4 $.
2	I'm checking them on kayak and Ice website.	Je les vérifie sur le site Web de kayak et de glace.
2	I know as soon as I buy them now, they're going to drop it should be cheaper than $327.	Je sais que dès que je les achèterai maintenant, ils vont laisser tomber ça devrait être moins cher que 327 $.
2	My mom paid like 280 or something like that.	Ma mère a payé 280 $ ou quelque chose comme ça.
2	It's cheaper at 280.	C'est moins cher à 280.
2	But if she's going to pay for one of them at 3:20, the question is how long I go out for I fly out on Friday.	Mais si elle va payer pour l'un d'eux à 3:20, la question est de savoir combien de temps je sors pour partir vendredi.
2	Hopefully if they're in the Super Bowl, that's the same day as her birthday party.	Espérons qu'ils soient dans le Super Bowl, c'est le même jour que sa fête d'anniversaire.
2	I'll come back on Monday or Tuesday.	Je reviendrai lundi ou mardi.
2	If I come back on Monday.	Si je reviens lundi.
2	We're literally out there for just two days, but it's not like I'm going to be up to take him and doing a whole bunch of stuff.	On est littéralement dehors pendant deux jours, mais ce n'est pas comme si j'allais l'emmener faire plein de trucs.
2	I don't know if I'm going to have to rent a car or not.	Je ne sais pas si je vais devoir louer une voiture ou pas.
2	That's what I said because I'm not that I should be concerned about how much school he misses.	C'est ce que j'ai dit parce que je ne suis pas que je devrais m'inquiéter de combien d'école il manque.
2	I don't think it's going to affect him.	Je ne pense pas que ça va l'affecter.
2	He's a smart kid.	C'est un gamin intelligent.
2	You can catch up.	Tu peux le rattraper.
1	Hopefully in first grade you won't get into too much trouble.	J'espère qu'en première, vous n'aurez pas trop d'ennuis.
2	Keep him out of trouble.	Empêchez-le d'avoir des ennuis.
2	I have a feeling he gets in more trouble there.	J'ai l'impression qu'il a plus d'ennuis là-bas.
2	It seems like Lucille is gradually more and more getting used to me.	Il semble que Lucille s'habitue progressivement de plus en plus à moi.
1	Good.	Tant mieux.
2	I can't leave every time I say I'll write Lucille.	Je ne peux pas partir à chaque fois que je dis que j'écrirai Lucille.
2	I'm going to go no, no, no, no.	Je vais y aller non, non, non, non.
1	Well good.	Très bien.
2	No, it's not good.	Non, ce n'est pas bon.
1	Well, is it good that she wants you around, right?	C'est bien qu'elle te veuille, non ?
2	Yeah, I feel guilty though.	Oui, je me sens coupable.
2	Usually I'll leave because I'm just bored out of my mind or just I don't know we were at Cub Scouts and I had a little sing along just in case you came they were in town Lucille was just holding on to my leg.	D'habitude, je partirai parce que je m'ennuie ou je ne sais pas qu'on était à Cub Scouts et j'ai eu un petit chant au cas où tu viendrais, ils étaient à Lucille en train de me tenir la jambe.
2	She was having fun titling behind my leg.	Elle s'amusait à jouer derrière ma jambe.
2	Sometimes you would just come up and what she usually does to Jess.	Parfois, tu allais juste monter et ce qu'elle fait habituellement à Jess.
2	She's scared.	Elle a peur.
2	So	Alors
2	but the good thing is you want.	Mais la bonne chose, c'est que tu veux.
2	To change diaper no mama.	Pour changer de couche pas de maman.
2	Okay and wanted to sleep over Friday.	D'accord et je voulais dormir vendredi.
2	I was just exhausted.	J'étais épuisée.
2	I can't remember why I was really against in was upset and just said I'm putting her in the middle of it.	Je ne me souviens pas pourquoi j'étais vraiment contre était énervé et juste dit que je la mets au milieu de ça.
2	I need to come to a set schedule.	J'ai besoin d'un planning.
2	I was like you asked me hours ago.	J'étais comme tu me l'as demandé il y a des heures.
2	You tell him then that I can't do it.	Dis-lui que je ne peux pas.
2	I was like you can come over Saturday Saturday then buddy what she did.	J'étais comme si tu pouvais venir samedi, samedi, puis faire ce qu'elle a fait.
1	He was over Saturday night.	Il était fini samedi soir.
2	Yeah, we went to a friend's house for deep fried turkey.	Oui, on est allés chez un ami pour une dinde frite.
2	He has a little boy and they got to watch TV the Disney Channel.	Il a un petit garçon et ils doivent regarder la chaîne Disney.
2	He doesn't have cable.	Il n'a pas de câble.
1	That was cool.	C'était cool.
2	He gets to see the TV shows his friends talk about that.	Il peut voir la télé montrer ses amis en parler.
2	He never gets to see because he sees you seems to know these shows.	Il ne voit jamais parce qu'il voit que tu connais ces spectacles.
2	I don't know where he would have seen them.	Je ne sais pas où il les aurait vus.
2	Then the next morning.	Puis le lendemain matin.
2	He spent the whole morning into the afternoon playing with the girl downstairs, which is good that he can come over and has friends there.	Il a passé toute la matinée dans l'après-midi à jouer avec la fille en bas, ce qui est bien qu'il puisse venir et avoir des amis là-bas.
2	It would drive me crazy if we were just cooped up in the apartment when we had buddy.	Ça me rendrait fou si on était juste enfermés dans l'appartement quand on avait un pote.
2	We used to always go to parks and seem to be walking around a lot more.	Nous allions toujours dans les parcs et nous nous promenions beaucoup plus.
1	Is he getting a little old to run in the Parks or do you still like them?	Est-ce qu'il devient un peu vieux pour courir dans les parcs ou tu les aimes encore ?
2	Yeah, I think he just gets bored quickly.	Oui, je pense qu'il s'ennuie vite.
2	So it's like the idea that he wants to go is still on his mind.	Donc c'est comme si l'idée qu'il veut y aller était toujours dans son esprit.
2	But once he gets there, he still likes Wings.	Mais une fois arrivé, il aime toujours les Wings.
2	He still wants to be pushed like dude.	Il veut toujours être poussé comme un mec.
2	Come on while we were down in Louisiana.	Venez pendant qu'on était en Louisiane.
2	My buddies kid had a bat and they had a bunch of tennis balls.	Mes potes avaient une batte et ils avaient des boules de tennis.
2	I was throwing them some soft pitches and he was taking some swings.	Je leur lançais des pitchs et il faisait des balançoires.
2	I was thinking that might be a good thing for us to do get him a bath and a bunch of tennis balls and go to the park.	Je pensais que c'était une bonne chose pour nous de lui donner un bain et un tas de balles de tennis et d'aller au parc.
2	I try and do that.	J'essaie de faire ça.
2	It's like you want to go throw frisbee.	C'est comme si tu voulais aller jeter frisbee.
2	Do you want to kick a soccer ball?	Tu veux donner un coup de pied à un ballon de foot ?
1	I was at the cool little break down the other day.	J'étais à la petite rupture l'autre jour.
2	with your daughters	avec vos filles
1	They have a lot of birthday parties.	Ils ont beaucoup de fêtes d'anniversaire.
1	They have a whole bunch of big inflatable slides and things like that.	Ils ont un tas de gros toboggans gonflables et des trucs comme ça.
2	I love those and used to be afraid to go on those by himself, but he loved it.	J'aime ça et j'avais peur d'y aller tout seul, mais il l'aimait.
2	I would get sick inside of those things.	Je serais malade à l'intérieur de ces choses.
2	I don't know if it was the air or what but I'd come out and I'd be so nauseous.	Je ne sais pas si c'était l'air ou quoi, mais je serais si nauséeuse.
2	He was like, let's do it again.	Il était comme, faisons-le encore.
2	Let's do it again.	Recommençons.
2	They have those at the fair, which is down in Louisiana.	Ils ont ceux à la foire, qui est en bas en Louisiane.
1	Right.	Oui.
1	You were telling me about that.	Vous m'en parliez.
2	He just starts going on them.	Il commence juste à y aller.
2	That was a slide, but they have the big blow up.	C'était un toboggan, mais ils ont la grosse explosion.
1	Oh I can obstacle course.	Oh, je peux faire obstacle à la course.
2	He just loves that stuff.	Il adore ce truc.
1	Why don't we stop for now?	Pourquoi on ne s'arrête pas pour l'instant ?
1	I think I ran a few more minutes late, but if we could do.	Je crois que j'ai couru encore quelques minutes en retard, mais si on pouvait le faire.
1	those on Friday that would probably be	ceux de vendredi qui seraient probablement
2	That's fine.	C'est bon.
2	If you need to take the time to write a letter, I feel bad that I'm giving you homework.	Si vous avez besoin de prendre le temps d'écrire une lettre, je me sens mal que je vous donne des devoirs.
